{
  "$schema": "https://json-schema.org/draft/2020-12/schema",
  "$id": "https://aletheia.local/schemas/governance-pack.schema.json",
  "title": "AletheIA Governance Pack",
  "type": "object",
  "additionalProperties": false,
  "required": ["meta", "hooks", "facts_model", "rules"],
  "properties": {
    "meta": {
      "type": "object",
      "additionalProperties": false,
      "required": ["name", "version", "domain", "status", "default_mode"],
      "properties": {
        "name":         { "type": "string", "minLength": 1 },
        "version":      { "type": "string", "minLength": 1 },
        "domain":       { "type": "string", "minLength": 1 },
        "status":       { "type": "string", "minLength": 1 },
        "default_mode": { "type": "string", "enum": ["strict", "balanced", "relaxed"] }
      }
    },
    "vocabulary": {
      "type": "object",
      "additionalProperties": { "type": "string" }
    },
    "hooks": {
      "type": "array",
      "minItems": 1,
      "items": {
        "type": "object",
        "additionalProperties": false,
        "required": ["id", "description"],
        "properties": {
          "id":          { "type": "string", "enum": ["before_execute", "after_execute", "before_finalize"] },
          "description": { "type": "string", "minLength": 1 }
        }
      }
    },
    "facts_model": {
      "type": "object",
      "additionalProperties": { "type": "string" }
    },
    "rules": {
      "type": "array",
      "items": {
        "type": "object",
        "additionalProperties": false,
        "required": ["id", "stage", "description", "enabled", "action_by_mode"],
        "properties": {
          "id":          { "type": "string", "minLength": 1 },
          "stage":       { "type": "string", "enum": ["before_execute", "after_execute", "before_finalize"] },
          "description": { "type": "string", "minLength": 1 },
          "enabled":     { "type": "boolean" },
          "when_all": {
            "type": "array",
            "items": { "$ref": "#/$defs/predicate" }
          },
          "when_any": {
            "type": "array",
            "items": { "$ref": "#/$defs/predicate" }
          },
          "action_by_mode": {
            "type": "object",
            "additionalProperties": false,
            "required": ["strict", "balanced", "relaxed"],
            "properties": {
              "strict":   { "type": "string", "enum": ["allow", "review", "ask_human", "block"] },
              "balanced": { "type": "string", "enum": ["allow", "review", "ask_human", "block"] },
              "relaxed":  { "type": "string", "enum": ["allow", "review", "ask_human", "block"] }
            }
          }
        }
      }
    }
  },
  "$defs": {
    "predicate": {
      "type": "object",
      "additionalProperties": false,
      "required": ["fact", "op", "value"],
      "properties": {
        "fact": { "type": "string", "minLength": 1 },
        "op":   { "type": "string", "enum": ["eq", "neq", "gt", "gte", "lt", "lte", "contains", "in"] },
        "value": {
          "oneOf": [
            { "type": "string" },
            { "type": "number" },
            { "type": "boolean" },
            { "type": "null" },
            {
              "type": "array",
              "items": {
                "oneOf": [
                  { "type": "string" },
                  { "type": "number" },
                  { "type": "boolean" },
                  { "type": "null" }
                ]
              }
            }
          ]
        }
      }
    }
  }
}
